"classifiedTitle","searchResultsAttributeValue","searchResultsAttributeValue 2","classified-price-container","searchResultsLocationValue"
"BUCA KİRALIK FIRSAT DAİRE","50","1+1","13.000 TL","Buca"
"İZMİR SEYREK BAKIRÇAY ÜNİVERSİTESİ YAKINI EŞYALI FULL DAİRE","90","2+1","16.000 TL","MenemenSeyrek"
"BUCA ADATEPE MAHALLESİ KİRALIK DAİRE","50","1+1","12.500 TL","Buca"
"Narlıdere Folkart Karşısı Caddeye 10Mt Mesafede Köşe 2+1 Kiralık","95","2+1","17.500 TL","Narlıdere"
"FOLKART LİFE RESIDENCE SIFIR LUX EŞYA HAVUZ PEYZAJ CEPHE 1+1","64","1+1","30.100 TL","BornovaKazımdirik"
"Yok Ferah Sahibinden 2+1 Konut Geniş","80","2+1","26.000 TL","Buca"
"Yeni Foça gencelli yazlık kiralık müstakil ev","110","3+1","40.000 TL","FoçaYenifoça"
"FOLKART LİFE EŞYALI STUDİO","30","Stüdyo (1+0)","17.000 TL","BornovaKazımdirik"
"URLA ÇEŞMEALTI'NDA 1+1 EŞYALI / EŞYASIZ KİRALIK DAİRE","90","1+1","22.500 TL","UrlaÇeşmealtı"
"Söz gayrimenkulden sıfır kiralık daireler","114","3+1","15.000 TL","Ödemiş"
"BUCA KURUÇEŞMEDE, PARK MANZARALI EŞYALI KİRALIK 1+1 DAİRE","52","1+1","9.500 TL","Buca"
"Narlıdere Narbel Sitesinde Otopark Asansörlü 3+1 Kiralık Daire","115","3+1","15.000 TL","Narlıdere"
"YENİ FOÇA HAVUZLU SİTEDE EŞYALI 2+1 KİRALIK ARA KAT DAİRE","130","2+1","30.000 TL","FoçaYenifoça"
"BUCA KAMPÜS KARŞISI EŞYALI D.GAZLI BAHÇE KATI 1+1 KİRALIK DAİRE","45","1+1","11.000 TL","Buca"
"SAHİBİNDEN 2+1 MERKEZİ KONUMDA","75","2+1","13.500 TL","Bayraklı"
"İZMİR BUCA YAYLACIK MAHALLASİNDE 3+1 KİRALIK DAİRE","135","3+1","17.000 TL","Buca"
"BORNOVADA KİRALIK DAIRE 1+1 SIFIR GÜVENLİKLİ SİTE İÇİ","50","1+1","15.000 TL","BornovaNaldöken"
"LÜKS FUL EŞYALI İZMIR MANZRALI 2+1 KIRALIK DAİRE","110","2+1","17.500 TL","BornovaAtatürk"
"CB Line'dan Bostanlı'ya Yürüme Mesafesinde Kiralık Daire","110","3+1","17.000 TL","KarşıyakaNergiz"
"EMLAK 53 |EFELER MAH D.GAZLI ARAKAT 3+1 DAİRE","110","3+1","15.000 TL","BucaŞirinyer"
"KOYUNDERE MERKEZDE 2+1 DOĞALGAZLI KAPALI OTOPARKLI DAİRE","95","2+1","13.500 TL","Menemen"
"___444'DEN___HASTANE KARŞISI NEVA SUITS SIFIR 1+1 K. OTOPARKLI","50","1+1","15.000 TL","BornovaNaldöken"
"KİRALIK 1+1 DAİRE","85","1+1","13.000 TL","BayraklıGümüşpala"
"Konak Kiralık 2+1 daire","120","2+1","17.000 TL","KonakEşrefpaşa"
"KİRALIK 2+1 KUPON DAİRE","110","2+1","14.000 TL","KarabağlarYeşilyurt"
"EMLAK 53|ATATÜRK MAH MERKEZİ KONUM FULL EŞYALI 1+1 DAİRE","55","1+1","8.000 TL","Buca"
"MURAT EMLAKTAN KİRALIK MALTEPE MAHALLESİNDE ARA KAT 2+1 DAİRE","110","2+1","17.500 TL","Bergama"
"ÇİĞLİ ESENETEPE HAS EVLERİ SİTESİ 135 M2 KİRALIK 3+1 DAİRE","135","3+1","30.000 TL","ÇiğliEgekent"
"Aksoy'da Denize Yakın Eşyalı 3+1 Kiralık Daire","160","3+1","30.000 TL","Karşıyaka"
"EŞYALI BAHCELİ 3+1","165","3+1","26.000 TL","BornovaAtatürk"
"2 + 1 içi yapılı Doğalgazlı daire","115","2+1","25.000 TL","KonakGüzelyalı"
"Doğalgazlı gaziemir yeşilyurt dolmuş son durağına yakın","100","2+1","15.000 TL","BornovaAtatürk"
"Kiralık daire","100","3+1","250.000 TL","ÇeşmeAlaçatı"
"BORNOVA GOLDİVA KUZEY'DE BAHÇEŞEHİR KARŞISI 2+1 KİRALIK DAİRE","132","2+1","26.000 TL","BornovaÇamdibi"
"Buca Adatepe'de Üniversite Yakını Köşe Konumda Kiralık 1+1 Daire","55","1+1","11.500 TL","Buca"
"MCD GROUP GAYRİMENKUL'DEN ÇAMLI KÖYÜNDE 2+1 KİRALIK DAİRE","110","2+1","14.250 TL","GüzelbahçeKöyler"
"Urla Kalabak'da DENİZE SIFIR ''Full Sıfır Eşyalı '' 2+1 Daire","75","2+1","40.000 TL","Urla"
"ALİAĞA YENİ MAH'de DENİZ MANZARALI KİRALIK GENİŞ 180m²-2+1-DAİRE","180","2+1","20.000 TL","Aliağa"
"VİVA GAYRİMENKULDEN HAVUZLU SİTE İÇERİSİNDE KİRALIK 3+1 DAİRE","165","3+1","17.000 TL","Torbalı"
"İKON TOWERDA ULTRA LÜKS EŞYALI KİRALIK DAİRE","190","2.5+1","60.000 TL","BornovaAltındağ"
"EFE EMLAKTAN URKMEZ MERSINALANI MAHALLESINDE 3+1 1.KAT DAIRE","150","3+1","20.000 TL","SeferihisarÜrkmez"
"FULL EŞYALI ARAKAT DOĞALGAZLI KİRALIK..","85","2+1","15.000 TL","Bergama"
"İzmir Karşıyaka Körfezköy Sitesi Kiralık 3+1 Daire","256","3+1","25.000 TL","Karşıyaka"
"ROYAL REZİDANS'TA KİRALIK AMERİKAN MUTFAK 2+1 DAİRE","90","2+1","20.000 TL","KarşıyakaCumhuriyet"
"Sahibinden Bornovada 2+1 kiralık daire","70","2+1","10.750 TL","BornovaÇamdibi"
"MENEMEN SEYREK TE, YENİ PAZAR YERİ KARŞISI KİRALIK 1+1 DAİRE","40","1+1","8.500 TL","MenemenSeyrek"
"TINAZTEPE'DE KAMPÜS KARŞISI KİRALIK SIFIR 2+1","80","2+1","25.000 TL","Buca"
"GÖZDE EMLAK'TAN BALÇOVA ONUR MAHALLESİ'NDE KİRALIK 2+1 DAİRE","100","2+1","15.000 TL","Balçova"
"Bornova Atatürk Mahallesinde Kiralık 3+1 Daire","120","3+1","15.000 TL","BornovaAtatürk"
"2+1 Eşyalı Doğalgazlı Klimalı Daire","80","2+1","17.500 TL","Buca"
"EMLAK DÜNYASI ÇEŞME KİRALIYOR| ÇEŞME MERKEZDE EŞYASIZ AY ÖDEMELİ","55","1+1","20.000 TL","Çeşme"